{
  "$schema": "https://json-schema.org/draft/2020-12/schema",
  "$id": "https://github.com/ofri-peretz/eslint/scripts/schemas/cve-rule-latency.schema.json",
  "title": "CVE → Rule Latency Audit Log",
  "description": "Append-only audit log mapping public CVE disclosures (in libraries / frameworks Interlace covers) to the rule that detects the underlying pattern. Source of truth for the §10 'CVE-disclosure-to-rule latency' metric in distribution/EVALUATION_METRICS.md.",
  "type": "object",
  "required": ["description", "entries", "summary", "process"],
  "properties": {
    "$schema": { "type": "string" },
    "description": { "type": "string" },
    "fieldDefinitions": {
      "type": "object",
      "description": "Inline glossary so the file is self-documenting outside the schema."
    },
    "entries": {
      "type": "array",
      "items": { "$ref": "#/$defs/entry" }
    },
    "summary": { "$ref": "#/$defs/summary" },
    "process": {
      "type": "object",
      "description": "Human-readable notes on the discovery cadence, append-only contract, and audit script."
    }
  },
  "$defs": {
    "entry": {
      "type": "object",
      "required": [
        "cveId",
        "cwe",
        "disclosed",
        "library",
        "rulePackage",
        "ruleName",
        "ruleFirstShipped",
        "latencyDays",
        "discoveryMode",
        "notes"
      ],
      "properties": {
        "cveId": {
          "type": "string",
          "pattern": "^CVE-\\d{4}-\\d{4,}$",
          "description": "Public CVE identifier (e.g. CVE-2019-10744)."
        },
        "cwe": {
          "type": "string",
          "pattern": "^CWE-\\d+$",
          "description": "MITRE CWE identifier."
        },
        "disclosed": {
          "type": "string",
          "format": "date",
          "description": "Public disclosure date (ISO 8601 YYYY-MM-DD)."
        },
        "library": { "type": "string" },
        "rulePackage": {
          "type": "string",
          "pattern": "^eslint-plugin-"
        },
        "ruleName": { "type": "string" },
        "ruleFirstShipped": {
          "type": "string",
          "format": "date"
        },
        "latencyDays": {
          "type": "integer",
          "description": "ruleFirstShipped - disclosed in calendar days. Negative = proactive coverage."
        },
        "discoveryMode": {
          "type": "string",
          "enum": ["cve-feed", "community", "audit", "proactive"],
          "description": "How we discovered the gap. Only 'cve-feed' entries are subject to the targetLatencyDays policy."
        },
        "notes": { "type": "string" },
        "rescinded": {
          "type": "boolean",
          "description": "Set true if the CVE was withdrawn or the rule retired. Never delete entries; rescind instead."
        }
      },
      "additionalProperties": false
    },
    "summary": {
      "type": "object",
      "required": [
        "asOf",
        "entryCount",
        "medianLatencyDays",
        "targetLatencyDays",
        "note"
      ],
      "properties": {
        "asOf": { "type": "string", "format": "date" },
        "entryCount": { "type": "integer", "minimum": 0 },
        "medianLatencyDays": { "type": "integer", "minimum": 0 },
        "targetLatencyDays": {
          "type": "integer",
          "minimum": 1,
          "description": "Policy ceiling for cve-feed entries. Default 14 days."
        },
        "note": { "type": "string" }
      },
      "additionalProperties": false
    }
  }
}
