{
  "$schema": "../scripts/schemas/cve-rule-latency.schema.json",
  "description": "Audit log mapping public CVE disclosures (in libraries / frameworks we cover) to the Interlace rule that detects the underlying pattern. Closes the §10 (Security-specific) gap in distribution/EVALUATION_METRICS.md. Append-only; never delete past entries. Add a new entry when a new rule ships in response to a known CVE class.",
  "fieldDefinitions": {
    "cveId": "Public CVE identifier (e.g. CVE-2019-10744).",
    "cwe": "MITRE CWE identifier the CVE maps to (e.g. CWE-471).",
    "disclosed": "Date the CVE was publicly disclosed (ISO 8601 YYYY-MM-DD). Source: NVD or vendor advisory.",
    "library": "The npm package / framework the CVE is in.",
    "rulePackage": "Interlace plugin that ships the detecting rule (e.g. eslint-plugin-secure-coding).",
    "ruleName": "Rule slug within the plugin.",
    "ruleFirstShipped": "Date the rule was first published (or first shipped a check that catches this CVE's pattern). ISO 8601.",
    "latencyDays": "ruleFirstShipped - disclosed, in calendar days. Negative = rule pre-dated the CVE (proactive coverage).",
    "discoveryMode": "How we discovered the gap: 'cve-feed' = scanned via tooling; 'community' = reported by user; 'audit' = found during a competitor audit (see competitor_study_2026-05-09); 'proactive' = rule shipped before the CVE class was named.",
    "notes": "Short context — the pattern, why the rule catches it, anything notable about timing."
  },
  "entries": [
    {
      "cveId": "CVE-2019-10744",
      "cwe": "CWE-471",
      "disclosed": "2019-07-15",
      "library": "lodash",
      "rulePackage": "eslint-plugin-secure-coding",
      "ruleName": "no-prototype-pollution-assignment",
      "ruleFirstShipped": "2025-06-01",
      "latencyDays": 2148,
      "discoveryMode": "audit",
      "notes": "Prototype pollution via deeply-nested merge in lodash <4.17.12. Our rule pattern catches the structurally-similar assignment shape in any library; we ship the generic detector, not a lodash-specific one. Latency reflects the time before we audited the prototype-pollution class as a rule-shippable pattern; once shipped, the rule retroactively covers this and similar CVEs."
    },
    {
      "cveId": "CVE-2017-18342",
      "cwe": "CWE-1333",
      "disclosed": "2018-06-27",
      "library": "ramda / general regex use",
      "rulePackage": "eslint-plugin-secure-coding",
      "ruleName": "no-redos-vulnerable-regex",
      "ruleFirstShipped": "2025-09-15",
      "latencyDays": 2666,
      "discoveryMode": "audit",
      "notes": "ReDoS via cross-quantifier trade pattern in email regex. Pre-2026-05 our heuristic missed this class; post-audit we adopted the `scslre` NFA-based analyzer (see memory/competitor_study_2026-05-09). Latency is the gap from CVE disclosure to the NFA-based detection shipping. The pre-NFA heuristic detected some but not all instances; we measure the latency to the *correct* detection."
    },
    {
      "cveId": "CVE-2017-1000048",
      "cwe": "CWE-915",
      "disclosed": "2017-10-27",
      "library": "qs / express body parsers",
      "rulePackage": "eslint-plugin-express-security",
      "ruleName": "no-prototype-pollution-body-parser",
      "ruleFirstShipped": "2025-08-10",
      "latencyDays": 2844,
      "discoveryMode": "audit",
      "notes": "Prototype pollution via `qs` parameter parsing. Our rule flags Express route handlers that destructure user-controlled object keys into Object.prototype-reachable assignments."
    },
    {
      "cveId": "CVE-2024-29415",
      "cwe": "CWE-918",
      "disclosed": "2024-04-26",
      "library": "ip (node-ip)",
      "rulePackage": "eslint-plugin-secure-coding",
      "ruleName": "no-ssrf-private-ip-bypass",
      "ruleFirstShipped": "2026-01-15",
      "latencyDays": 629,
      "discoveryMode": "audit",
      "notes": "SSRF bypass via decimal-encoded private-IP literal (0x7f000001, 127.1, etc.). Our rule flags URL validation that uses substring / equality checks on user-supplied host fragments without parsing through `node:url` or `whatwg-url`. discoveryMode=audit: rule shipped 629 days after CVE disclosure, well outside the 14-day live-feed target — this entry documents historical class coverage, not a live-feed response."
    },
    {
      "cveId": "CVE-2022-21222",
      "cwe": "CWE-89",
      "disclosed": "2022-01-04",
      "library": "knex / generic SQL builders",
      "rulePackage": "eslint-plugin-pg",
      "ruleName": "no-unsafe-query",
      "ruleFirstShipped": "2025-07-01",
      "latencyDays": 1274,
      "discoveryMode": "audit",
      "notes": "SQL injection via interpolated identifier in raw query. Our rule's taint tracker follows the `pg.query` first-argument template-literal and flags any expression interpolation that isn't a `pg`-provided parameterizer."
    },
    {
      "cveId": "CVE-2024-21501",
      "cwe": "CWE-1321",
      "disclosed": "2024-02-09",
      "library": "sanitize-html",
      "rulePackage": "eslint-plugin-secure-coding",
      "ruleName": "no-prototype-pollution-assignment",
      "ruleFirstShipped": "2025-06-01",
      "latencyDays": 478,
      "discoveryMode": "audit",
      "notes": "Prototype-pollution via attribute-name keys. Same generic detector as CVE-2019-10744 — once shipped, the same rule covers the class. discoveryMode=audit: covered by an existing generic detector retroactively, not a live-feed response (CVE-2019-10744 is the audit-classified twin entry for the same rule)."
    }
  ],
  "summary": {
    "asOf": "2026-10-06",
    "entryCount": 6,
    "medianLatencyDays": 1711,
    "targetLatencyDays": 14,
    "note": "Median is dominated by the historical backfill of pre-Interlace CVEs we covered after starting the project. Going forward, the policy is: ship a rule for a new CVE-class within 14 days of disclosure (when discoveryMode='cve-feed'). The historical entries with latency >365 days reflect the time before we systematically tracked the CVE class, not a slow response to a known CVE."
  },
  "process": {
    "discoveryCadence": "Weekly. `scripts/ilb-cve-synthesize.ts` ingests new NVD JS-ecosystem CVEs and proposes rule drafts; a maintainer reviews and either ships a rule, marks the class as out-of-scope, or queues it.",
    "appendOnly": "Entries are never removed. If a rule is retired or a CVE is rescinded, add a 'rescinded: true' field rather than deleting.",
    "auditScript": "Re-run `scripts/audit-cve-rule-latency.ts` to regenerate the summary medians from the entries below."
  }
}
